id,name,email,phone,gpa,skills,education,college,location,category,past_internships,preferred_companies,github_profile,linkedin_profile,resume_score,availability_start,preferred_duration,expected_stipend,willingness_to_relocate,is_rural,is_female,experience,created_at
STU00699,Fatima Q. Mehta,fatima699@college.ac.in,07727050894,7.63,"ethical hacking, reinforcement learning, kotlin, ios, flutter, google cloud",M.Tech CSE,Manipal Institute,Ahmedabad,general,2,"Wipro, Tech Mahindra, Axis Bank, KPMG",,https://linkedin.com/in/fatima-mehta-699,77.2,2025-12-10,12,49304,Preferred,False,False,6,2025-09-05T01:29:29.258066
STU00700,Sunita Thakur,sunita.thakur@student.edu,06022411587,8.47,"powerpoint, tableau, project management, firewall, deep learning, ios, sketch, power bi, flutter, excel",B.Tech CSE,IIT Madras,Kolkata,rural,2,"Amazon, Apple, Cognizant, EY",https://github.com/sunitathakur700,https://linkedin.com/in/sunita-thakur-700,85.7,2025-11-29,12,62839,No,True,False,18,2025-09-09T01:29:29.258066
STU00701,Arnav Agarwal,agarwal.arnav@gmail.com,5575050662,7.17,"pytorch, kotlin, terraform, kubernetes, react, flutter, azure, ansible, google cloud",B.Tech ECE,SRM Chennai,Surat,rural,3,"Tech Mahindra, JP Morgan, PhonePe, HDFC Bank, Meta",https://github.com/arnavagarwal701,https://linkedin.com/in/arnav-agarwal-701,68.8,2025-10-19,6,39658,Preferred,True,True,13,2025-09-08T01:29:29.258066
STU00702,Nisha Rajput,nisha702@college.ac.in,8994597259,7.01,"vue.js, penetration testing, android, kotlin, react, rust, kubernetes, angular, django, express.js",MCA,NIT Surathkal,Hyderabad,female,0,"Apple, Axis Bank, BYJU'S",https://github.com/nisharajput702,https://linkedin.com/in/nisha-rajput-702,72.9,2025-10-19,6,59080,Preferred,False,True,22,2025-09-13T01:29:29.259075
STU00703,Riya Verma,riya703@college.ac.in,6694589778,7.76,"react native, flask, scikit-learn, ios, photoshop",M.Tech CSE,IIT Roorkee,Jaipur,general,4,"TCS, ICICI Bank, Freshworks, Infosys, PhonePe, EY, HDFC Bank, Microsoft",,https://linkedin.com/in/riya-verma-703,82.4,2025-11-30,6,34314,No,False,False,9,2025-08-26T01:29:29.259075
STU00704,Pooja H. Aggarwal,pooja.aggarwal@student.edu,5460876902,9.2,"adobe illustrator, c++, django, flutter, rust, go",B.E Computer Science,BITS Pilani,Jaipur,general,0,"Deloitte, EY, PhonePe, Cognizant, Netflix, Unacademy, ICICI Bank, Wipro",,https://linkedin.com/in/pooja-aggarwal-704,93.3,2025-10-19,6,31050,Yes,False,True,22,2025-08-31T01:29:29.259075
STU00705,Arjun L. Iyer,arjun705@college.ac.in,9843176015,7.72,"reinforcement learning, computer vision, pytorch, natural language processing, tensorflow, oracle",MCA,IIT Roorkee,Jaipur,general,1,"HDFC Bank, JP Morgan, Freshworks, Paytm, Netflix, ICICI Bank, PwC, KPMG",https://github.com/arjuniyer705,https://linkedin.com/in/arjun-iyer-705,84.6,2025-11-06,3,55144,No,False,False,8,2025-08-26T01:29:29.259585
STU00706,Sneha Jain,snehajain706@email.com,+916035701322,9.1,"powerpoint, java, project management, r, business analysis, power bi, kubernetes, excel",B.Tech CSE,Manipal Institute,Mumbai,general,0,"Meta, HDFC Bank, Netflix",https://github.com/snehajain706,https://linkedin.com/in/sneha-jain-706,73.6,2025-11-29,12,40978,Preferred,False,True,20,2025-08-20T01:29:29.259585
STU00707,Harsh Jindal,harsh707@college.ac.in,7758388963,6.3,"project management, cassandra, postgresql, tensorflow, django, oracle",B.Tech IT,IIT Guwahati,Kolkata,rural,2,"McKinsey, BYJU'S, JP Morgan, ICICI Bank, Unacademy, EY, Zomato",https://github.com/harshjindal707,,72.4,2025-12-07,3,77223,Yes,True,False,12,2025-09-10T01:29:29.259585
STU00708,Ira Mittal,ira.mittal@student.edu,03600141538,8.64,"powerpoint, project management, figma, scikit-learn, sap, power bi, excel, go",B.E Computer Science,IIT Delhi,Bangalore,general,0,"Microsoft, HCL Technologies, Goldman Sachs, EY, Unacademy, Meta",https://github.com/iramittal708,,74.2,2025-12-11,3,17055,No,False,True,23,2025-08-30T01:29:29.259585
STU00709,Sunita Pandey,sunita.pandey@student.edu,+910139979521,9.14,"tableau, pytorch, scikit-learn, ruby, kotlin, excel, tensorflow, machine learning",B.Tech CSE,IIT Guwahati,Jaipur,general,0,"Tech Mahindra, Accenture, Ola, BYJU'S, ICICI Bank",,https://linkedin.com/in/sunita-pandey-709,78.0,2025-11-20,12,21430,No,False,True,22,2025-08-23T01:29:29.259585
STU00710,Khushi Aggarwal,aggarwal.khushi@gmail.com,01907011640,7.49,"firewall, django, cryptography, go, ansible, network security",B.Tech CSE,IIT Kharagpur,Mumbai,general,1,"PwC, Flipkart, Unacademy, Microsoft, TCS, ICICI Bank",https://github.com/khushiaggarwal710,,90.5,2025-11-30,3,19489,Yes,False,False,2,2025-09-07T01:29:29.260592
STU00711,Aadhya J. Kapoor,aadhyakapoor711@email.com,04031198322,8.98,"ethical hacking, numpy, computer vision, kotlin, deep learning, sap, pandas, angular, tensorflow, machine learning",M.Tech CSE,SRM Chennai,Hyderabad,general,0,"EY, KPMG, Wipro, McKinsey",,https://linkedin.com/in/aadhya-kapoor-711,78.8,2025-11-06,3,22353,No,False,False,19,2025-08-25T01:29:29.260592
STU00712,Dev Jain,jain.dev@gmail.com,+911011439371,6.34,"pytorch, oracle, r",MBA,NIT Warangal,Mumbai,rural,1,"Cognizant, Microsoft, Infosys, HDFC Bank, HCL Technologies, Tech Mahindra, Accenture, PwC",,,85.6,2025-10-18,6,46087,Preferred,True,True,12,2025-09-13T01:29:29.260592
STU00713,Ira R. Singh,ira.singh@student.edu,09125778883,6.72,"ethical hacking, figma, reinforcement learning, neural networks, natural language processing",B.Sc Computer Science,IIT Kanpur,Kolkata,female,1,"Amazon, BYJU'S, Morgan Stanley, Netflix, Deloitte, HCL Technologies",,https://linkedin.com/in/ira-singh-713,78.9,2025-11-08,12,48188,Yes,False,True,9,2025-08-18T01:29:29.260592
STU00714,Vihaan Agarwal,vihaan.agarwal@student.edu,00626124221,8.59,"elasticsearch, numpy, jenkins, aws, kubernetes, power bi, google cloud",B.Tech ECE,NIT Warangal,Gurgaon,reserved,2,"JP Morgan, BYJU'S, Zomato, Morgan Stanley, Freshworks, Accenture, Cognizant, Amazon",https://github.com/vihaanagarwal714,https://linkedin.com/in/vihaan-agarwal-714,73.1,2025-11-04,12,15521,Preferred,False,True,1,2025-09-14T01:29:29.261592
STU00715,Ayaan Thakur,ayaanthakur715@email.com,+919051767322,6.7,"neural networks, terraform, azure, javascript, mongodb",B.E Computer Science,IIT Kharagpur,Noida,rural,0,"Tech Mahindra, Goldman Sachs, Amazon, HDFC Bank, ICICI Bank",https://github.com/ayaanthakur715,https://linkedin.com/in/ayaan-thakur-715,72.8,2025-10-18,12,25717,No,True,True,11,2025-08-20T01:29:29.261592
STU00716,Amit C. Joshi,amit.joshi@student.edu,6629279566,6.82,"swift, react native, tableau, mysql, java, xamarin, flask, android, business analysis",B.E Computer Science,NIT Trichy,Bangalore,reserved,1,"Ola, Tech Mahindra, Axis Bank, Freshworks, Deloitte, Morgan Stanley",https://github.com/amitjoshi716,https://linkedin.com/in/amit-joshi-716,91.1,2025-11-21,12,35673,No,False,False,18,2025-09-12T01:29:29.261592
STU00717,Kavya Shah,kavyashah717@email.com,0438124506,8.67,"powerpoint, tableau, business analysis, neural networks, c#, cryptography, aws, power bi, excel, tensorflow",B.Tech IT,VIT Vellore,Hyderabad,reserved,0,"Swiggy, Meta, Morgan Stanley",,https://linkedin.com/in/kavya-shah-717,69.0,2025-11-05,12,65084,Preferred,False,False,0,2025-08-26T01:29:29.261592
STU00718,Saanvi Malhotra,saanvimalhotra718@email.com,01789395451,7.61,"swift, react native, node.js, tableau, mysql, xamarin, android, kotlin, neural networks, flutter, azure, cassandra",M.Tech AI/ML,IIT Delhi,Kolkata,general,3,"Tech Mahindra, BYJU'S, McKinsey, Deloitte",https://github.com/saanvimalhotra718,https://linkedin.com/in/saanvi-malhotra-718,85.7,2025-12-09,3,25163,Yes,False,True,17,2025-09-11T01:29:29.261592
STU00719,Geeta X. Tiwari,geetatiwari719@email.com,4582515448,7.8,"swift, react native, node.js, android, azure, django",B.Tech CSE,IIT Bombay,Delhi,general,1,"Cognizant, HCL Technologies, Zomato, KPMG, HDFC Bank, Amazon",https://github.com/geetatiwari719,https://linkedin.com/in/geeta-tiwari-719,85.7,2025-11-18,3,72618,No,False,False,20,2025-08-25T01:29:29.262592
STU00720,Sunita Saxena,sunitasaxena720@email.com,8865423337,6.62,"python, jenkins, android, firewall, cryptography, kubernetes, docker, angular, google cloud",B.E Computer Science,NIT Calicut,Noida,rural,2,"Tech Mahindra, Paytm, TCS, Apple, Morgan Stanley, HDFC Bank, Amazon, HCL Technologies",https://github.com/sunitasaxena720,,87.9,2025-11-10,6,52434,No,True,True,17,2025-08-17T01:29:29.262592
STU00721,Meena Chopra,meena.chopra@student.edu,01370090407,6.38,"r, computer vision, deep learning, php, cryptography, redis, pandas",MCA,SRM Chennai,Noida,female,3,"Goldman Sachs, HDFC Bank, Tech Mahindra, Google, Ola, Freshworks, ICICI Bank",https://github.com/meenachopra721,https://linkedin.com/in/meena-chopra-721,75.5,2025-11-22,12,65946,Preferred,False,True,12,2025-09-13T01:29:29.262592
STU00722,Riya Saxena,riyasaxena722@email.com,5072961249,6.08,"swift, android, adobe illustrator, kotlin, computer vision, ios, firewall, c++",MBA,NIT Calicut,Pune,general,1,"Amazon, Cognizant, Deloitte, Accenture, Wipro",https://github.com/riyasaxena722,https://linkedin.com/in/riya-saxena-722,62.9,2025-11-02,12,41642,No,False,True,11,2025-08-19T01:29:29.262592
STU00723,Ravi L. Saxena,saxena.ravi@gmail.com,08867959849,6.59,"react native, android, kotlin, aws, flutter, go",B.Tech CSE,BMS College,Gurgaon,general,2,"Goldman Sachs, EY, HCL Technologies, Paytm, Netflix, Infosys",,https://linkedin.com/in/ravi-saxena-723,66.8,2025-10-17,12,15499,Preferred,False,False,6,2025-09-05T01:29:29.262592
STU00724,Aahan Joshi,joshi.aahan@gmail.com,+917589980263,8.54,"java, flask, computer vision, c++, c#, django, php, javascript, go",B.Tech CSE,IIT Guwahati,Kolkata,general,0,"KPMG, PhonePe, Infosys",https://github.com/aahanjoshi724,https://linkedin.com/in/aahan-joshi-724,86.0,2025-11-07,6,19423,Yes,False,True,19,2025-08-31T01:29:29.263593
STU00725,Pooja Chauhan,poojachauhan725@email.com,08435336353,7.75,"powerpoint, reinforcement learning, computer vision, neural networks, natural language processing, kubernetes, postgresql, excel",B.Sc Computer Science,NIT Surathkal,Ahmedabad,rural,1,"Swiggy, Wipro, Zomato, HCL Technologies, Freshworks",https://github.com/poojachauhan725,,67.8,2025-11-15,3,71259,Preferred,True,True,22,2025-09-15T01:29:29.263593
STU00726,Pooja S. Goel,poojagoel726@email.com,0694223033,6.93,"reinforcement learning, computer vision, neural networks, php, cassandra, go, oracle",B.Sc Computer Science,NIT Calicut,Noida,rural,3,"Google, Netflix, Unacademy, HDFC Bank, JP Morgan",https://github.com/poojagoel726,https://linkedin.com/in/pooja-goel-726,74.6,2025-10-28,12,20685,No,True,True,3,2025-09-13T01:29:29.263593
STU00727,Arnav Pandey,arnavpandey727@email.com,03730362799,6.61,"firewall, mysql, cassandra, redis",B.Tech CSE,IIT Kanpur,Mumbai,reserved,1,"Morgan Stanley, Freshworks, Apple",https://github.com/arnavpandey727,https://linkedin.com/in/arnav-pandey-727,64.9,2025-12-02,6,33203,Yes,False,True,14,2025-09-07T01:29:29.263593
STU00728,Reyansh Iyer,reyanshiyer728@email.com,04841088995,6.93,"numpy, reinforcement learning, computer vision, neural networks, php, natural language processing, docker, azure",B.Tech CSE,PES University,Bangalore,general,0,"Netflix, HCL Technologies, Google, TCS, Tech Mahindra, Wipro, Zomato, Deloitte",https://github.com/reyanshiyer728,https://linkedin.com/in/reyansh-iyer-728,66.8,2025-12-10,3,35979,Preferred,False,True,3,2025-08-19T01:29:29.264592
STU00729,Rahul W. Chauhan,chauhan.rahul@gmail.com,+914832449100,9.19,"node.js, vue.js, project management, numpy, r, scikit-learn, deep learning, cryptography, tensorflow, machine learning, ansible, mongodb",M.Tech CSE,IIT Madras,Kolkata,general,0,"McKinsey, Meta, Axis Bank, Deloitte, ICICI Bank, BYJU'S, JP Morgan, Infosys",https://github.com/rahulchauhan729,https://linkedin.com/in/rahul-chauhan-729,70.1,2025-11-25,6,51863,Yes,False,False,23,2025-08-31T01:29:29.264592
STU00730,Vikram Z. Sharma,vikramsharma730@email.com,00699374429,6.09,"elasticsearch, ethical hacking, penetration testing, ruby, firewall, pandas, network security",MCA,PES University,Ahmedabad,general,2,"JP Morgan, KPMG, ICICI Bank, Ola",,https://linkedin.com/in/vikram-sharma-730,74.3,2025-11-09,6,40779,No,False,True,8,2025-08-18T01:29:29.264592
STU00731,Khushi Goel,khushigoel731@email.com,+910735267466,8.91,"node.js, numpy, computer vision, neural networks, natural language processing, docker",B.Tech CSE,IIT Kharagpur,Bangalore,female,2,"JP Morgan, Zomato, Axis Bank, Cognizant, Ola, HCL Technologies, McKinsey",https://github.com/khushigoel731,https://linkedin.com/in/khushi-goel-731,68.3,2025-11-10,12,75984,Yes,False,True,16,2025-09-14T01:29:29.264592
STU00732,Atharv L. Jindal,atharvjindal732@email.com,+913928503722,7.6,"node.js, natural language processing, c#, aws, kubernetes, ansible, network security",B.Sc Computer Science,RV College,Chennai,general,1,"KPMG, Netflix, Freshworks, Morgan Stanley, Ola, PhonePe",https://github.com/atharvjindal732,https://linkedin.com/in/atharv-jindal-732,67.6,2025-12-09,6,79455,No,False,False,20,2025-08-28T01:29:29.264592
STU00733,Sai Mittal,saimittal733@email.com,+910610658772,8.57,"java, tableau, ruby, c++, sap, react, javascript, go, ansible, spring boot",MCA,NIT Calicut,Chennai,female,0,"Meta, Freshworks, Swiggy, ICICI Bank, Microsoft, Cognizant, Amazon, KPMG",https://github.com/saimittal733,https://linkedin.com/in/sai-mittal-733,65.3,2025-11-06,3,21448,Yes,False,True,5,2025-08-18T01:29:29.265598
STU00734,Shaurya K. Bansal,shauryabansal734@email.com,+912050193678,7.52,"numpy, r, machine learning, react, kubernetes, django, express.js, spring boot",B.Tech IT,IIT Roorkee,Gurgaon,reserved,2,"Tech Mahindra, PhonePe, BYJU'S, Wipro, Flipkart, KPMG, McKinsey, ICICI Bank",https://github.com/shauryabansal734,https://linkedin.com/in/shaurya-bansal-734,64.4,2025-11-13,3,75845,Preferred,False,True,3,2025-09-05T01:29:29.265598
STU00735,Rohan Malhotra,rohanmalhotra735@email.com,9171811978,8.9,"swift, powerpoint, xamarin, kotlin, azure, google cloud",B.Tech ECE,IIT Kanpur,Ahmedabad,rural,0,"McKinsey, Zomato, ICICI Bank, Unacademy, Paytm",https://github.com/rohanmalhotra735,https://linkedin.com/in/rohan-malhotra-735,92.5,2025-11-28,6,41349,No,True,True,10,2025-09-11T01:29:29.265598
STU00736,Anika Chauhan,anikachauhan736@email.com,+912088582296,8.87,"ethical hacking, project management, r, adobe illustrator, wireframing",B.Sc Computer Science,NIT Warangal,Hyderabad,general,0,"McKinsey, PhonePe, Amazon, BYJU'S, Swiggy",https://github.com/anikachauhan736,https://linkedin.com/in/anika-chauhan-736,94.7,2025-11-19,12,42355,Yes,False,True,14,2025-09-02T01:29:29.265598
STU00737,Arjun V. Kumar,arjun737@college.ac.in,08078087574,8.19,"swift, ethical hacking, penetration testing, ruby, firewall, cryptography, kubernetes",B.Sc Computer Science,BITS Pilani,Ahmedabad,female,0,"Deloitte, Google, HDFC Bank, Paytm, Ola, Accenture, ICICI Bank, Apple",https://github.com/arjunkumar737,https://linkedin.com/in/arjun-kumar-737,63.5,2025-11-11,3,38886,No,False,True,14,2025-09-03T01:29:29.266598
STU00738,Saanvi B. Agarwal,saanvi.agarwal@student.edu,+914752249501,6.82,"r, pytorch, scikit-learn, adobe illustrator, excel, machine learning",B.Tech ECE,IIT Roorkee,Gurgaon,general,0,"Freshworks, Zomato, Amazon, Netflix, Infosys, EY, Morgan Stanley, McKinsey",https://github.com/saanviagarwal738,https://linkedin.com/in/saanvi-agarwal-738,80.9,2025-11-06,12,57969,Preferred,False,False,6,2025-09-01T01:29:29.266598
STU00739,Pari E. Pandey,pari739@college.ac.in,01687853202,9.48,"java, figma, c++, ios, php, c#, sap, rust, spring boot",M.Tech CSE,NIT Calicut,Hyderabad,rural,4,"Netflix, Swiggy, Tech Mahindra, Microsoft, Google",https://github.com/paripandey739,https://linkedin.com/in/pari-pandey-739,61.3,2025-11-05,6,18996,No,True,False,15,2025-08-19T01:29:29.266598
STU00740,Meena Agarwal,meena740@college.ac.in,+913563825547,9.01,"java, xamarin, android, ruby, kotlin, postgresql, network security",B.Tech CSE,IIT Madras,Delhi,reserved,1,"Microsoft, Flipkart, Wipro, PhonePe, Unacademy",,https://linkedin.com/in/meena-agarwal-740,93.3,2025-10-28,12,73018,Preferred,False,True,24,2025-08-18T01:29:29.266598
STU00741,Reyansh Agarwal,reyansh.agarwal@student.edu,08240897108,6.54,"reinforcement learning, computer vision, neural networks, natural language processing, php, terraform, rust",B.E Computer Science,IIT Madras,Kolkata,general,2,"Tech Mahindra, Meta, PwC",https://github.com/reyanshagarwal741,https://linkedin.com/in/reyansh-agarwal-741,74.7,2025-11-24,3,58800,Preferred,False,False,0,2025-09-02T01:29:29.266598
STU00742,Nisha Iyer,nisha.iyer@student.edu,+918702318555,8.1,"project management, adobe illustrator, sap, sketch, php, kubernetes, wireframing",B.Tech ECE,NIT Calicut,Bangalore,general,2,"KPMG, EY, Morgan Stanley, Google, McKinsey",https://github.com/nishaiyer742,https://linkedin.com/in/nisha-iyer-742,62.5,2025-10-28,6,28992,Yes,False,True,20,2025-09-10T01:29:29.267599
STU00743,Harsh S. Jindal,jindal.harsh@gmail.com,9269898900,7.78,"penetration testing, jenkins, c++, ios, php, c#, rust, pandas, javascript, go",M.Tech AI/ML,IIT Delhi,Surat,general,1,"Flipkart, Swiggy, JP Morgan, Ola",,https://linkedin.com/in/harsh-jindal-743,89.1,2025-11-20,6,50924,Yes,False,False,4,2025-09-06T01:29:29.267599
STU00744,Amit Malhotra,amit744@college.ac.in,03970609986,8.13,"java, figma, numpy, adobe illustrator, sketch, ui/ux design, rust",MBA,Manipal Institute,Kolkata,reserved,0,"Flipkart, Apple, Freshworks, Tech Mahindra",https://github.com/amitmalhotra744,https://linkedin.com/in/amit-malhotra-744,91.6,2025-12-12,6,27624,Preferred,False,True,8,2025-08-19T01:29:29.267599
STU00745,Ayaan T. Rajput,rajput.ayaan@gmail.com,05937401964,7.7,"tableau, figma, ios, sketch, photoshop, angular, wireframing",B.Sc Computer Science,IIT Bombay,Pune,general,0,"Swiggy, Infosys, Zomato, Deloitte, Netflix, BYJU'S",,https://linkedin.com/in/ayaan-rajput-745,85.3,2025-12-08,6,42171,Preferred,False,True,1,2025-08-30T01:29:29.268601
STU00746,Shaurya Kumar,shaurya.kumar@student.edu,1358478740,7.18,"powerpoint, project management, pytorch, kotlin, business analysis, c++, aws, power bi",MCA,NIT Calicut,Jaipur,general,1,"Google, Wipro, Deloitte, PhonePe, Accenture, KPMG, Axis Bank, Freshworks",https://github.com/shauryakumar746,https://linkedin.com/in/shaurya-kumar-746,93.4,2025-12-11,3,20097,Yes,False,False,21,2025-09-11T01:29:29.268601
STU00747,Aadhya Thakur,aadhyathakur747@email.com,+915311513261,6.96,"swift, react native, tableau, xamarin, jenkins, adobe illustrator, kotlin, firewall, ansible",B.Tech ECE,SRM Chennai,Pune,female,1,"PwC, TCS, Accenture, Microsoft, Axis Bank, Netflix, Swiggy, Goldman Sachs",https://github.com/aadhyathakur747,,70.3,2025-10-21,12,27154,No,False,True,8,2025-09-10T01:29:29.268601
STU00748,Saanvi L. Verma,saanvi748@college.ac.in,01736281266,9.34,"node.js, neural networks, natural language processing, sap, react, express.js, spring boot, google cloud",M.Tech CSE,IIT Kanpur,Jaipur,rural,2,"Wipro, McKinsey, Deloitte, Morgan Stanley, Unacademy",,https://linkedin.com/in/saanvi-verma-748,83.8,2025-11-22,3,77732,Yes,True,False,10,2025-09-08T01:29:29.268601
STU00749,Pari Joshi,pari.joshi@student.edu,1063846707,9.21,"business analysis, neural networks, terraform, kubernetes, ansible",M.Tech CSE,IIT Bombay,Chennai,reserved,1,"Swiggy, TCS, Flipkart, Google, Freshworks",https://github.com/parijoshi749,https://linkedin.com/in/pari-joshi-749,66.0,2025-12-03,3,38060,Preferred,False,False,16,2025-08-23T01:29:29.269599
STU00750,Aditya F. Gupta,aditya.gupta@student.edu,+911657933881,6.68,"ethical hacking, python, natural language processing, django, express.js, spring boot",B.Tech CSE,NIT Trichy,Delhi,rural,0,"HCL Technologies, PhonePe, Wipro, Accenture, PwC, Flipkart",https://github.com/adityagupta750,https://linkedin.com/in/aditya-gupta-750,66.6,2025-11-02,3,64217,Yes,True,True,5,2025-09-09T01:29:29.269599
STU00751,Aahan Nair,aahan.nair@student.edu,+915677718143,8.68,"angular, c#, azure, oracle, google cloud",B.Tech ECE,PES University,Hyderabad,reserved,2,"ICICI Bank, Meta, HCL Technologies, Microsoft, Flipkart",,https://linkedin.com/in/aahan-nair-751,76.0,2025-10-30,3,57623,Preferred,False,True,17,2025-08-22T01:29:29.269599
STU00752,Lata Y. Rajput,rajput.lata@gmail.com,03071729348,9.05,"vue.js, mysql, flutter, express.js, oracle, spring boot",M.Tech AI/ML,PES University,Mumbai,general,3,"BYJU'S, TCS, Paytm",,https://linkedin.com/in/lata-rajput-752,93.6,2025-11-19,6,19335,No,False,True,24,2025-08-26T01:29:29.269599
STU00753,Riya Gupta,riya.gupta@student.edu,2073008544,8.98,"powerpoint, figma, xamarin, jenkins, adobe illustrator, c++, sketch, ui/ux design, photoshop, mongodb",B.Tech CSE,IIT Kanpur,Surat,rural,1,"ICICI Bank, PwC, Wipro, Swiggy",https://github.com/riyagupta753,https://linkedin.com/in/riya-gupta-753,69.3,2025-12-14,6,42440,Yes,True,False,12,2025-08-31T01:29:29.270599
STU00754,Aryan Chauhan,aryanchauhan754@email.com,09131985779,6.28,"vue.js, reinforcement learning, computer vision, neural networks, redis, express.js",B.Tech IT,IIT Roorkee,Pune,general,0,"Flipkart, PwC, PhonePe",,https://linkedin.com/in/aryan-chauhan-754,66.7,2025-11-13,12,67125,No,False,True,23,2025-09-14T01:29:29.270599
STU00755,Sneha Z. Jain,sneha755@college.ac.in,02450753292,6.41,"node.js, ruby, firewall, terraform, aws, google cloud",MCA,Manipal Institute,Chennai,rural,2,"Paytm, Netflix, Amazon, Swiggy, JP Morgan",,https://linkedin.com/in/sneha-jain-755,60.5,2025-11-02,6,53831,Preferred,True,True,10,2025-08-29T01:29:29.270599
STU00756,Pihu Gupta,pihu.gupta@student.edu,09830285943,7.32,"swift, numpy, business analysis, neural networks, natural language processing",B.Tech IT,IIT Madras,Gurgaon,general,1,"Apple, Goldman Sachs, PwC, BYJU'S, Unacademy, Microsoft, Paytm, Cognizant",https://github.com/pihugupta756,,61.4,2025-11-15,12,72920,Preferred,False,False,3,2025-08-28T01:29:29.270599
STU00757,Kartik W. Aggarwal,kartik757@college.ac.in,05883678151,7.84,"node.js, ruby, express.js, neural networks",B.Tech IT,NIT Warangal,Pune,general,0,"Zomato, McKinsey, Axis Bank, Accenture, Paytm, Unacademy, TCS",https://github.com/kartikaggarwal757,https://linkedin.com/in/kartik-aggarwal-757,63.1,2025-10-28,3,15894,No,False,False,8,2025-08-22T01:29:29.271600
STU00758,Shaurya Sharma,sharma.shaurya@gmail.com,05689497126,9.37,"swift, java, tableau, xamarin, kotlin, c++, ios",B.E Computer Science,RV College,Gurgaon,general,1,"Ola, Freshworks, PhonePe, Accenture, PwC, Apple",,https://linkedin.com/in/shaurya-sharma-758,78.5,2025-12-03,6,35754,No,False,False,23,2025-08-22T01:29:29.271600
STU00759,Krishna Jain,krishna.jain@student.edu,+912666043438,8.15,"elasticsearch, python, computer vision, ruby, c++, rust, javascript, django, network security",B.Tech IT,Manipal Institute,Mumbai,general,2,"Swiggy, Ola, Deloitte, Meta",https://github.com/krishnajain759,,65.8,2025-10-20,12,16300,No,False,False,22,2025-08-17T01:29:29.271600
STU00760,Darsh Iyer,iyer.darsh@gmail.com,+919093667247,6.76,"numpy, r, reinforcement learning, computer vision, jenkins, firewall, neural networks, natural language processing, react, photoshop, mongodb",MCA,PES University,Delhi,female,2,"Wipro, McKinsey, Infosys",https://github.com/darshiyer760,https://linkedin.com/in/darsh-iyer-760,74.3,2025-10-24,3,15105,Preferred,False,True,16,2025-08-21T01:29:29.271600
STU00761,Saanvi Yadav,saanvi761@college.ac.in,08630947830,6.67,"ethical hacking, penetration testing, mysql, firewall, natural language processing, cryptography, redis, mongodb",MCA,RV College,Hyderabad,general,2,"Microsoft, EY, KPMG, TCS",https://github.com/saanviyadav761,https://linkedin.com/in/saanvi-yadav-761,78.5,2025-11-18,3,69986,Preferred,False,True,1,2025-09-10T01:29:29.271600
STU00762,Aryan Shah,shah.aryan@gmail.com,6401018217,8.93,"jenkins, adobe illustrator, c++, c#, terraform, javascript, go, ansible",B.Tech CSE,IIT Madras,Jaipur,reserved,2,"PhonePe, Freshworks, JP Morgan, TCS, Microsoft, Tech Mahindra, Accenture",https://github.com/aryanshah762,https://linkedin.com/in/aryan-shah-762,72.0,2025-11-19,3,57580,Yes,False,True,6,2025-08-31T01:29:29.272598
STU00763,Priya Sharma,sharma.priya@gmail.com,8820336304,6.08,"elasticsearch, react native, mysql, adobe illustrator, deep learning, redis, react, postgresql, angular, machine learning, mongodb",MCA,NIT Surathkal,Noida,female,1,"ICICI Bank, McKinsey, Paytm, EY",https://github.com/priyasharma763,,87.3,2025-10-26,3,69220,No,False,True,21,2025-09-12T01:29:29.272598
STU00764,Aditya Goyal,aditya.goyal@student.edu,08510672381,8.98,"reinforcement learning, computer vision, pytorch, sap, natural language processing",MBA,IIIT Hyderabad,Hyderabad,general,2,"Google, Morgan Stanley, Microsoft, Zomato, ICICI Bank, Meta, Freshworks, BYJU'S",https://github.com/adityagoyal764,https://linkedin.com/in/aditya-goyal-764,75.4,2025-10-18,12,40580,Preferred,False,True,19,2025-09-05T01:29:29.272598
STU00765,Dev Aggarwal,aggarwal.dev@gmail.com,9131683949,6.55,"ethical hacking, numpy, xamarin, firewall, cryptography, power bi, network security, google cloud",B.Sc Computer Science,BMS College,Chennai,rural,2,"PwC, Wipro, Tech Mahindra, Microsoft, EY, Flipkart, Unacademy, Swiggy",https://github.com/devaggarwal765,https://linkedin.com/in/dev-aggarwal-765,60.0,2025-11-20,12,15411,Preferred,True,False,6,2025-09-02T01:29:29.273319
STU00766,Saanvi B. Bansal,saanvibansal766@email.com,9880039022,7.88,"react native, penetration testing, pytorch, adobe illustrator, firewall, ios, c#, cryptography, network security",B.Tech CSE,IIT Kharagpur,Gurgaon,general,0,"BYJU'S, Netflix, Flipkart",https://github.com/saanvibansal766,https://linkedin.com/in/saanvi-bansal-766,83.7,2025-12-05,3,71224,Yes,False,False,6,2025-09-13T01:29:29.273319
