id,name,email,phone,gpa,skills,education,college,location,category,past_internships,preferred_companies,github_profile,linkedin_profile,resume_score,availability_start,preferred_duration,expected_stipend,willingness_to_relocate,is_rural,is_female,experience,created_at
STU00489,Amit Y. Mehta,amit.mehta@student.edu,1004157877,8.1,"figma, xamarin, flask, pytorch, adobe illustrator, sketch, ui/ux design, power bi, photoshop, angular, django, wireframing",M.Tech AI/ML,SRM Chennai,Mumbai,general,2,"Amazon, Accenture, EY, Morgan Stanley, Google, PwC, Swiggy, HCL Technologies",https://github.com/amitmehta489,,61.8,2025-11-04,6,73169,Preferred,False,False,9,2025-09-12T01:29:29.211414
STU00490,Geeta Sharma,geeta.sharma@student.edu,9413701346,6.66,"powerpoint, firewall, sap, docker, excel, mongodb",B.Tech IT,NIT Calicut,Ahmedabad,general,0,"BYJU'S, Flipkart, Google, HCL Technologies",,https://linkedin.com/in/geeta-sharma-490,67.9,2025-10-27,6,27997,Preferred,False,True,19,2025-09-15T01:29:29.211994
STU00491,Keya Malhotra,keyamalhotra491@email.com,+917707014650,8.38,"ethical hacking, firewall, c#, php, cryptography, pandas, network security",B.Tech ECE,IIT Kharagpur,Noida,general,1,"Microsoft, Zomato, Wipro, Paytm, PhonePe, Ola",https://github.com/keyamalhotra491,,67.4,2025-11-14,12,27082,Yes,False,True,22,2025-08-26T01:29:29.211994
STU00492,Harsh P. Mehta,mehta.harsh@gmail.com,04762278045,7.55,"ethical hacking, numpy, cryptography, react, machine learning",B.Tech IT,IIT Delhi,Ahmedabad,reserved,0,"PhonePe, BYJU'S, Axis Bank, Paytm",https://github.com/harshmehta492,,80.9,2025-11-29,12,65202,No,False,False,19,2025-09-07T01:29:29.211994
STU00493,Rekha Saxena,rekhasaxena493@email.com,+912724697847,6.75,"powerpoint, elasticsearch, tableau, project management, xamarin, ruby, business analysis, sap, pandas, angular",B.E Computer Science,NIT Warangal,Chennai,general,1,"Swiggy, TCS, Cognizant, Accenture, Ola, EY",https://github.com/rekhasaxena493,https://linkedin.com/in/rekha-saxena-493,65.2,2025-11-06,3,32288,Preferred,False,True,16,2025-09-02T01:29:29.211994
STU00494,Vihaan Bansal,bansal.vihaan@gmail.com,6245793649,6.7,"ethical hacking, computer vision, neural networks",B.Sc Computer Science,NIT Warangal,Delhi,general,0,"Swiggy, HDFC Bank, Unacademy, Netflix",https://github.com/vihaanbansal494,https://linkedin.com/in/vihaan-bansal-494,69.4,2025-10-18,3,56056,Preferred,False,False,7,2025-09-12T01:29:29.211994
STU00495,Anaya Goel,anaya.goel@student.edu,+915845374445,7.14,"ethical hacking, penetration testing, java, firewall, deep learning, kotlin, cryptography, pandas, tensorflow, network security",B.Tech CSE,SRM Chennai,Bangalore,general,0,"Paytm, PhonePe, Axis Bank, Freshworks, Swiggy",https://github.com/anayagoel495,,93.6,2025-10-19,12,62611,Yes,False,False,6,2025-09-07T01:29:29.213007
STU00496,Pooja Joshi,poojajoshi496@email.com,8452262287,8.14,"r, xamarin, android, kotlin, ios, pandas, postgresql, express.js",MCA,NIT Trichy,Jaipur,general,1,"Goldman Sachs, Freshworks, PhonePe, Unacademy, BYJU'S, Flipkart",,,61.9,2025-11-11,12,34929,Yes,False,True,8,2025-09-06T01:29:29.213007
STU00497,Tara M. Tiwari,taratiwari497@email.com,+912917728048,7.07,"vue.js, machine learning, flask, sketch, ui/ux design, redis, angular, express.js, excel, spring boot",B.Tech CSE,PES University,Gurgaon,general,2,"PwC, Meta, BYJU'S, Axis Bank, Freshworks",https://github.com/taratiwari497,https://linkedin.com/in/tara-tiwari-497,93.9,2025-11-06,3,73198,Yes,False,False,4,2025-08-17T01:29:29.213007
STU00498,Kartik Z. Mittal,kartik498@college.ac.in,05599762476,8.68,"mysql, pytorch, android, cassandra, redis, flutter, pandas, kubernetes, oracle",MCA,IIT Guwahati,Chennai,rural,0,"Deloitte, HDFC Bank, BYJU'S, Microsoft",https://github.com/kartikmittal498,https://linkedin.com/in/kartik-mittal-498,66.6,2025-11-10,12,52479,Preferred,True,False,5,2025-08-24T01:29:29.213007
STU00499,Atharv B. Agarwal,atharv.agarwal@student.edu,7091760204,7.93,"react native, flutter, c++, ios",B.Tech IT,VIT Vellore,Gurgaon,general,1,"Amazon, BYJU'S, Infosys, Wipro, Apple, Ola",https://github.com/atharvagarwal499,https://linkedin.com/in/atharv-agarwal-499,78.7,2025-11-22,3,43046,No,False,True,9,2025-09-03T01:29:29.213007
STU00500,Anika Z. Patel,anika500@college.ac.in,+913760636638,8.48,"react native, r, pytorch, kotlin, deep learning, pandas, rust, power bi",B.Tech CSE,IIT Madras,Kolkata,rural,2,"EY, Apple, HCL Technologies, KPMG, Flipkart, Morgan Stanley, Swiggy",,https://linkedin.com/in/anika-patel-500,68.1,2025-10-19,3,57783,Preferred,True,False,16,2025-08-26T01:29:29.214004
STU00501,Amit Sharma,sharma.amit@gmail.com,+916315729708,6.57,"react native, terraform, postgresql, swift",B.Tech CSE,IIIT Hyderabad,Pune,rural,0,"Apple, KPMG, EY",https://github.com/amitsharma501,https://linkedin.com/in/amit-sharma-501,90.1,2025-10-22,12,42532,No,True,True,0,2025-09-05T01:29:29.214004
STU00502,Geeta Chauhan,geetachauhan502@email.com,+917681656820,7.63,"elasticsearch, ethical hacking, penetration testing, scikit-learn, firewall, ios, cryptography, excel, wireframing",B.Sc Computer Science,VIT Vellore,Gurgaon,rural,2,"Microsoft, HCL Technologies, Ola",https://github.com/geetachauhan502,https://linkedin.com/in/geeta-chauhan-502,91.8,2025-12-07,3,34017,Yes,True,True,3,2025-08-19T01:29:29.214004
STU00503,Krishna Verma,krishnaverma503@email.com,02655971240,7.23,"swift, photoshop, tableau, reinforcement learning, computer vision, neural networks, natural language processing, docker, javascript",B.E Computer Science,IIT Bombay,Bangalore,reserved,2,"TCS, EY, McKinsey, Tech Mahindra, JP Morgan, HCL Technologies",https://github.com/krishnaverma503,https://linkedin.com/in/krishna-verma-503,68.1,2025-11-26,6,24052,Yes,False,True,21,2025-09-10T01:29:29.214004
STU00504,Rohan Bansal,rohanbansal504@email.com,08696196181,7.42,"tableau, mysql, mongodb, ui/ux design, redis, oracle, google cloud",B.Tech IT,NIT Warangal,Hyderabad,reserved,2,"Meta, Google, Wipro, Accenture, Cognizant, Amazon, KPMG, BYJU'S",https://github.com/rohanbansal504,https://linkedin.com/in/rohan-bansal-504,83.5,2025-11-17,6,54794,No,False,False,19,2025-09-10T01:29:29.215004
STU00505,Arnav Kumar,arnav.kumar@student.edu,00220430372,7.71,"numpy, pytorch, scikit-learn, flask, kotlin, deep learning, c#",B.Sc Computer Science,IIT Kharagpur,Bangalore,rural,2,"Apple, Goldman Sachs, Wipro, ICICI Bank, HCL Technologies, McKinsey, BYJU'S, Accenture",https://github.com/arnavkumar505,,71.2,2025-11-25,3,61842,Preferred,True,False,14,2025-09-06T01:29:29.215004
STU00506,Sita Nair,sitanair506@email.com,7903621485,7.56,"ethical hacking, r, scikit-learn, aws, excel",B.E Computer Science,IIT Delhi,Hyderabad,reserved,0,"ICICI Bank, Deloitte, Microsoft, Apple, Swiggy",https://github.com/sitanair506,https://linkedin.com/in/sita-nair-506,69.9,2025-10-25,12,30212,Yes,False,False,20,2025-08-30T01:29:29.215004
STU00507,Arnav P. Verma,arnavverma507@email.com,+917240932233,7.95,"swift, elasticsearch, android, kotlin, ios, rust, postgresql, azure",B.Tech CSE,IIT Madras,Gurgaon,rural,2,"Wipro, Deloitte, Ola, Meta, KPMG, Flipkart, McKinsey",,https://linkedin.com/in/arnav-verma-507,92.1,2025-12-09,3,49414,Preferred,True,False,2,2025-09-08T01:29:29.215004
STU00508,Rekha Thakur,rekha508@college.ac.in,1446738707,9.52,"vue.js, mysql, flask, sap, aws, react, power bi, django, spring boot",M.Tech AI/ML,NIT Trichy,Gurgaon,rural,0,"HDFC Bank, Axis Bank, Goldman Sachs",https://github.com/rekhathakur508,https://linkedin.com/in/rekha-thakur-508,80.3,2025-12-04,6,61864,Preferred,True,True,24,2025-08-17T01:29:29.215004
STU00509,Advaith E. Verma,advaithverma509@email.com,+919364159042,6.42,"ios, android, ui/ux design, figma",B.Tech IT,IIT Guwahati,Surat,rural,0,"Amazon, PwC, KPMG, Microsoft, Zomato, ICICI Bank, Meta",https://github.com/advaithverma509,https://linkedin.com/in/advaith-verma-509,71.4,2025-12-03,3,60992,No,True,False,13,2025-08-23T01:29:29.216010
STU00510,Ira Joshi,joshi.ira@gmail.com,+913999177335,8.45,"penetration testing, sketch, react, javascript, django",MBA,NIT Surathkal,Noida,female,3,"Infosys, Netflix, Goldman Sachs, PwC",,https://linkedin.com/in/ira-joshi-510,72.7,2025-11-25,12,27541,Preferred,False,True,10,2025-09-10T01:29:29.216010
STU00511,Ayaan Mehta,mehta.ayaan@gmail.com,0768187842,9.46,"swift, python, pytorch, firewall, c++, php, c#, cryptography, photoshop, go",M.Tech CSE,BMS College,Surat,reserved,0,"Swiggy, Axis Bank, Cognizant, JP Morgan, PhonePe, Goldman Sachs",https://github.com/ayaanmehta511,https://linkedin.com/in/ayaan-mehta-511,80.2,2025-10-21,12,78194,No,False,True,19,2025-09-03T01:29:29.216010
STU00512,Pari Nair,pari.nair@student.edu,04960485169,8.66,"python, numpy, r, figma, pytorch, scikit-learn, deep learning, business analysis, react",B.Tech CSE,BITS Pilani,Ahmedabad,general,2,"Amazon, Accenture, Ola, PhonePe, KPMG, Deloitte, McKinsey, Unacademy",,https://linkedin.com/in/pari-nair-512,88.9,2025-11-03,3,19323,Preferred,False,True,3,2025-09-04T01:29:29.216010
STU00513,Anika Agarwal,anika513@college.ac.in,06714338507,7.55,"elasticsearch, react native, node.js, java, mysql, cassandra, power bi, oracle, network security",B.Tech IT,IIT Kanpur,Bangalore,reserved,0,"Apple, Amazon, Netflix",https://github.com/anikaagarwal513,https://linkedin.com/in/anika-agarwal-513,83.6,2025-11-08,6,15514,No,False,False,9,2025-09-11T01:29:29.216010
STU00514,Karan E. Iyer,karan514@college.ac.in,09260652286,8.6,"swift, mysql, xamarin, redis, kubernetes, wireframing, oracle, mongodb",M.Tech CSE,NIT Surathkal,Pune,general,2,"EY, Microsoft, Goldman Sachs, Netflix, Zomato, Amazon, Wipro",https://github.com/karaniyer514,https://linkedin.com/in/karan-iyer-514,66.7,2025-11-08,6,26302,Preferred,False,False,22,2025-09-14T01:29:29.217011
STU00515,Lata Pandey,pandey.lata@gmail.com,+917082583300,9.01,"elasticsearch, java, business analysis, deep learning, redis, cassandra, wireframing, oracle, mongodb",B.E Computer Science,SRM Chennai,Bangalore,general,1,"Accenture, JP Morgan, ICICI Bank, Paytm, Cognizant, Netflix",https://github.com/latapandey515,https://linkedin.com/in/lata-pandey-515,60.1,2025-11-09,6,15762,Preferred,False,False,22,2025-08-24T01:29:29.217011
STU00516,Rita Nair,ritanair516@email.com,+913783421363,7.63,"react native, photoshop, terraform, aws, docker, express.js, ansible, google cloud",B.E Computer Science,PES University,Hyderabad,reserved,1,"Unacademy, Swiggy, Freshworks, Infosys, McKinsey, Morgan Stanley, Ola",https://github.com/ritanair516,https://linkedin.com/in/rita-nair-516,89.7,2025-11-06,12,61126,No,False,False,4,2025-09-11T01:29:29.217011
STU00517,Saanvi Aggarwal,saanvi517@college.ac.in,5838158817,8.1,"ruby, natural language processing, php, aws, rust, go",B.Tech CSE,IIT Bombay,Jaipur,general,0,"Apple, Tech Mahindra, JP Morgan, Amazon, Flipkart",https://github.com/saanviaggarwal517,https://linkedin.com/in/saanvi-aggarwal-517,84.0,2025-12-05,6,46879,Preferred,False,False,9,2025-09-13T01:29:29.217011
STU00518,Darsh Singh,darsh518@college.ac.in,2939689949,7.84,"adobe illustrator, ui/ux design, power bi, kubernetes",B.Tech IT,IIT Roorkee,Pune,rural,0,"Axis Bank, PwC, Wipro",https://github.com/darshsingh518,,80.0,2025-11-20,3,50685,Yes,True,False,11,2025-08-20T01:29:29.218014
STU00519,Atharv D. Mehta,mehta.atharv@gmail.com,+914641910686,8.16,"node.js, vue.js, xamarin, pytorch, scikit-learn, ruby, pandas, tensorflow, go",B.Tech IT,SRM Chennai,Delhi,reserved,0,"Infosys, Paytm, Meta",,https://linkedin.com/in/atharv-mehta-519,89.4,2025-11-15,6,33519,Preferred,False,True,6,2025-08-24T01:29:29.218014
STU00520,Sunita Singh,singh.sunita@gmail.com,8280136334,8.29,"java, python, mysql, c++, business analysis, natural language processing, rust, javascript, mongodb",B.E Computer Science,IIT Kanpur,Delhi,general,0,"Deloitte, KPMG, PhonePe",,,69.0,2025-11-30,3,37993,Yes,False,False,3,2025-08-30T01:29:29.218014
STU00521,Anaya Mishra,anaya.mishra@student.edu,+919742292906,7.36,"node.js, android, vue.js, rust",B.Tech CSE,IIT Delhi,Pune,rural,2,"HCL Technologies, PhonePe, Freshworks, Meta, Deloitte, BYJU'S, EY, Netflix",https://github.com/anayamishra521,,63.3,2025-12-12,6,70479,No,True,False,0,2025-08-17T01:29:29.218014
STU00522,Sara Y. Goyal,saragoyal522@email.com,3878518000,7.87,"figma, photoshop, excel, express.js, mongodb",B.E Computer Science,SRM Chennai,Kolkata,rural,0,"Netflix, PhonePe, Ola, Flipkart, Goldman Sachs",https://github.com/saragoyal522,https://linkedin.com/in/sara-goyal-522,83.8,2025-10-31,6,18333,Yes,True,True,8,2025-09-09T01:29:29.219011
STU00523,Aditi I. Thakur,aditithakur523@email.com,+912162179810,8.96,"reinforcement learning, computer vision, flask, natural language processing, cryptography, postgresql",M.Tech AI/ML,BMS College,Gurgaon,general,3,"BYJU'S, Tech Mahindra, PhonePe, Netflix, Wipro, HCL Technologies, Deloitte",,https://linkedin.com/in/aditi-thakur-523,61.4,2025-11-01,12,73001,Preferred,False,False,16,2025-08-18T01:29:29.219011
STU00524,Aditya Saxena,aditya524@college.ac.in,9628076474,6.85,"node.js, xamarin, azure, neural networks, pandas, angular, django, express.js",MCA,IIT Guwahati,Surat,general,1,"Infosys, Google, Ola, Axis Bank, Morgan Stanley, PwC",https://github.com/adityasaxena524,https://linkedin.com/in/aditya-saxena-524,70.6,2025-11-10,3,31377,Preferred,False,True,20,2025-08-25T01:29:29.219011
STU00525,Rohan Goyal,rohangoyal525@email.com,+914580478027,7.02,"figma, business analysis, oracle, kubernetes, docker, ansible",B.Tech IT,VIT Vellore,Hyderabad,general,0,"Meta, KPMG, JP Morgan, PhonePe, Amazon",,https://linkedin.com/in/rohan-goyal-525,81.8,2025-12-10,3,58219,Yes,False,False,6,2025-08-26T01:29:29.219011
STU00526,Suresh Y. Sharma,suresh.sharma@student.edu,+913516899839,8.6,"elasticsearch, wireframing, cassandra, ios",B.Tech IT,IIIT Hyderabad,Pune,rural,2,"Freshworks, Infosys, HCL Technologies, Amazon, Ola",https://github.com/sureshsharma526,https://linkedin.com/in/suresh-sharma-526,62.2,2025-12-06,12,43005,No,True,False,5,2025-08-21T01:29:29.219011
STU00527,Kavya H. Iyer,iyer.kavya@gmail.com,2056066455,6.22,"elasticsearch, mysql, r, terraform, cassandra, docker, azure, oracle",B.Tech IT,NIT Surathkal,Surat,general,0,"Morgan Stanley, HCL Technologies, JP Morgan",,https://linkedin.com/in/kavya-iyer-527,75.0,2025-10-21,12,44995,No,False,True,5,2025-08-21T01:29:29.220011
STU00528,Arnav Rajput,arnav528@college.ac.in,00059971599,8.84,"python, pytorch, natural language processing, rust, javascript, go, cassandra",M.Tech CSE,IIT Madras,Surat,general,3,"PwC, Apple, Tech Mahindra, ICICI Bank, Unacademy",,https://linkedin.com/in/arnav-rajput-528,75.3,2025-11-30,3,47916,Preferred,False,False,22,2025-09-10T01:29:29.220011
STU00529,Anika E. Agarwal,anika.agarwal@student.edu,01358126570,8.89,"powerpoint, vue.js, azure, sap, terraform, power bi, excel, machine learning, mongodb",M.Tech CSE,PES University,Gurgaon,general,2,"Amazon, Accenture, Tech Mahindra, Google, Netflix, JP Morgan",https://github.com/anikaagarwal529,https://linkedin.com/in/anika-agarwal-529,65.7,2025-10-28,3,56951,Yes,False,True,6,2025-09-02T01:29:29.220011
STU00530,Shaurya Yadav,shauryayadav530@email.com,04224717384,6.59,"python, numpy, r, deep learning, wireframing, angular, tensorflow, django, machine learning",B.E Computer Science,IIT Delhi,Mumbai,general,0,"Paytm, Freshworks, HCL Technologies, PwC, Unacademy, Swiggy, Accenture",https://github.com/shauryayadav530,https://linkedin.com/in/shaurya-yadav-530,84.2,2025-10-19,12,76550,Preferred,False,False,22,2025-08-26T01:29:29.220011
STU00531,Khushi Mittal,khushimittal531@email.com,9316452267,7.43,"vue.js, java, ruby, neural networks, c#, redis, postgresql",B.Tech CSE,Manipal Institute,Surat,rural,2,"Microsoft, Cognizant, McKinsey, PhonePe, Deloitte",https://github.com/khushimittal531,https://linkedin.com/in/khushi-mittal-531,78.7,2025-10-23,12,77946,Yes,True,True,21,2025-08-25T01:29:29.221010
STU00532,Vikram Saxena,vikram532@college.ac.in,+912808950607,8.77,"node.js, ethical hacking, swift, flask, business analysis, terraform, ui/ux design, react, tensorflow, django, express.js, spring boot",MCA,IIIT Hyderabad,Surat,general,2,"Unacademy, Morgan Stanley, Infosys, Meta",,https://linkedin.com/in/vikram-saxena-532,64.2,2025-11-14,12,39825,Preferred,False,False,12,2025-08-28T01:29:29.221010
STU00533,Daksh U. Malhotra,malhotra.daksh@gmail.com,9433271067,8.97,"elasticsearch, xamarin, computer vision, ansible, aws, cassandra, redis, postgresql, oracle",M.Tech AI/ML,NIT Surathkal,Hyderabad,general,4,"HCL Technologies, Meta, Tech Mahindra, HDFC Bank",https://github.com/dakshmalhotra533,,85.0,2025-11-30,6,28465,Preferred,False,True,11,2025-08-26T01:29:29.221010
STU00534,Aditya Bansal,aditya.bansal@student.edu,5095537605,8.61,"powerpoint, project management, mysql, r, business analysis, natural language processing, excel, spring boot",B.Sc Computer Science,NIT Trichy,Chennai,reserved,0,"Meta, Flipkart, Apple, Freshworks, Deloitte, Cognizant",https://github.com/adityabansal534,,69.5,2025-11-11,6,34532,Preferred,False,False,16,2025-09-13T01:29:29.221010
STU00535,Shaurya N. Shah,shah.shaurya@gmail.com,02295748472,6.61,"ethical hacking, penetration testing, project management, php, cryptography, pandas, azure, wireframing, network security",B.Sc Computer Science,IIT Guwahati,Delhi,reserved,0,"HDFC Bank, ICICI Bank, TCS, Tech Mahindra, Freshworks, Infosys",https://github.com/shauryashah535,https://linkedin.com/in/shaurya-shah-535,93.7,2025-12-03,6,26326,No,False,True,18,2025-08-29T01:29:29.221010
STU00536,Ananya Patel,patel.ananya@gmail.com,08620215416,7.71,"vue.js, java, python, computer vision, c++, neural networks, c#, php, rust, kubernetes, tensorflow",MCA,RV College,Chennai,general,1,"Paytm, Amazon, Morgan Stanley",,https://linkedin.com/in/ananya-patel-536,73.1,2025-12-10,6,56176,Preferred,False,False,24,2025-08-25T01:29:29.222009
STU00537,Keya Kumar,keyakumar537@email.com,04589843200,9.39,"postgresql, ui/ux design, figma, swift",B.Tech CSE,BITS Pilani,Kolkata,reserved,3,"Tech Mahindra, EY, PwC, Unacademy, Flipkart, Paytm, Microsoft",https://github.com/keyakumar537,,94.0,2025-11-30,3,64744,Preferred,False,True,18,2025-08-27T01:29:29.222009
STU00538,Geeta Bansal,geeta538@college.ac.in,+914565506189,8.33,"vue.js, tableau, python, project management, sap",B.Tech CSE,NIT Calicut,Surat,general,0,"McKinsey, Cognizant, Infosys, KPMG, PwC, PhonePe",,,67.6,2025-10-26,3,24141,Preferred,False,True,10,2025-09-03T01:29:29.222009
STU00539,Aryan Jindal,aryan.jindal@student.edu,+914183131525,6.8,"pytorch, computer vision, numpy, neural networks",B.Tech CSE,NIT Warangal,Hyderabad,general,0,"ICICI Bank, EY, JP Morgan, Goldman Sachs, PwC",,https://linkedin.com/in/aryan-jindal-539,72.6,2025-11-18,6,29130,No,False,True,11,2025-08-28T01:29:29.222009
STU00540,Vikram P. Patel,vikrampatel540@email.com,09691926085,8.58,"kotlin, neural networks, natural language processing, rust, machine learning",MCA,Manipal Institute,Delhi,female,4,"PwC, Tech Mahindra, Goldman Sachs, HDFC Bank, Apple, PhonePe, Ola",,https://linkedin.com/in/vikram-patel-540,71.5,2025-11-24,3,73438,Preferred,False,True,21,2025-09-06T01:29:29.222009
STU00541,Reyansh Mehta,reyansh541@college.ac.in,5732435603,8.95,"react native, xamarin, android, ios, aws, azure, wireframing, cassandra, spring boot",B.Sc Computer Science,IIT Delhi,Hyderabad,general,1,"Cognizant, Swiggy, Axis Bank, Ola, Accenture",https://github.com/reyanshmehta541,https://linkedin.com/in/reyansh-mehta-541,78.3,2025-10-18,6,65162,Yes,False,False,8,2025-09-10T01:29:29.223010
STU00542,Myra R. Shah,shah.myra@gmail.com,2064926653,8.13,"react native, java, numpy, scikit-learn, ruby, kotlin, c++, php, rust, go, mongodb",MCA,NIT Calicut,Gurgaon,general,4,"Netflix, EY, HCL Technologies, Swiggy",https://github.com/myrashah542,,79.6,2025-12-14,12,59494,Preferred,False,True,22,2025-09-04T01:29:29.223010
STU00543,Kartik Jain,jain.kartik@gmail.com,+919308834496,6.82,"project management, business analysis, c++, flutter, react, excel, ansible",MBA,IIT Roorkee,Mumbai,general,0,"Microsoft, Infosys, EY",https://github.com/kartikjain543,https://linkedin.com/in/kartik-jain-543,79.7,2025-10-18,12,33856,Preferred,False,False,2,2025-09-12T01:29:29.223010
STU00544,Shaurya Gupta,shaurya544@college.ac.in,06626080249,7.5,"java, reinforcement learning, computer vision, ruby, neural networks, c#",B.Tech CSE,NIT Surathkal,Kolkata,general,0,"Goldman Sachs, Paytm, Ola, Swiggy",https://github.com/shauryagupta544,https://linkedin.com/in/shaurya-gupta-544,63.4,2025-12-09,12,79825,Yes,False,True,14,2025-09-02T01:29:29.223010
STU00545,Aarav Sharma,aarav545@college.ac.in,+910154219258,7.19,"vue.js, react, django, express.js, spring boot",B.Tech ECE,RV College,Jaipur,female,2,"EY, Swiggy, Cognizant, Axis Bank, Google, Deloitte",,https://linkedin.com/in/aarav-sharma-545,69.8,2025-12-04,12,75695,Preferred,False,True,6,2025-08-19T01:29:29.224009
STU00546,Meena Mehta,mehta.meena@gmail.com,4501945034,9.25,"numpy, reinforcement learning, adobe illustrator, deep learning, power bi",B.Tech CSE,NIT Warangal,Kolkata,reserved,0,"BYJU'S, PhonePe, Cognizant",https://github.com/meenamehta546,https://linkedin.com/in/meena-mehta-546,82.0,2025-11-11,6,72021,Yes,False,True,12,2025-09-06T01:29:29.224009
STU00547,Daksh Malhotra,malhotra.daksh@gmail.com,+914341302457,8.97,"figma, business analysis, sap, kubernetes, photoshop, wireframing",M.Tech AI/ML,PES University,Delhi,rural,3,"Netflix, Paytm, Apple, HDFC Bank, Deloitte, KPMG",https://github.com/dakshmalhotra547,https://linkedin.com/in/daksh-malhotra-547,75.9,2025-11-10,3,51463,Yes,True,True,10,2025-08-30T01:29:29.224009
STU00548,Arjun Jain,jain.arjun@gmail.com,+914889632221,6.73,"elasticsearch, swift, flask, natural language processing, react, spring boot",B.E Computer Science,NIT Warangal,Ahmedabad,general,0,"Zomato, Axis Bank, EY",,https://linkedin.com/in/arjun-jain-548,72.2,2025-11-10,6,61765,Yes,False,True,3,2025-08-24T01:29:29.224009
STU00549,Rita Bansal,bansal.rita@gmail.com,6425471696,7.3,"java, project management, adobe illustrator, django, rust, go",B.Tech CSE,IIIT Hyderabad,Gurgaon,general,2,"Paytm, Amazon, ICICI Bank, HCL Technologies, Tech Mahindra, McKinsey, TCS",https://github.com/ritabansal549,https://linkedin.com/in/rita-bansal-549,70.2,2025-11-17,12,37910,Yes,False,True,15,2025-09-07T01:29:29.224009
STU00550,Anika O. Chauhan,anika550@college.ac.in,+916905935490,7.29,"react native, ios, flutter, angular, excel, cassandra",MCA,PES University,Mumbai,general,2,"PwC, PhonePe, Freshworks, Unacademy",,https://linkedin.com/in/anika-chauhan-550,68.7,2025-11-08,6,72248,Yes,False,False,23,2025-09-09T01:29:29.225011
STU00551,Tara Sharma,sharma.tara@gmail.com,+910830147152,6.88,"mysql, reinforcement learning, computer vision, business analysis, neural networks, natural language processing, terraform, tensorflow, express.js",B.Sc Computer Science,SRM Chennai,Pune,general,1,"Netflix, Zomato, ICICI Bank, Deloitte",,https://linkedin.com/in/tara-sharma-551,94.5,2025-10-27,6,53111,Preferred,False,True,12,2025-08-23T01:29:29.225011
STU00552,Aryan Agarwal,aryan.agarwal@student.edu,8937977631,6.05,"react native, android, kotlin, ios, pandas, django, google cloud",B.Tech IT,NIT Trichy,Surat,general,3,"Paytm, Netflix, ICICI Bank, Amazon, Unacademy, Zomato, Flipkart, Accenture",,,70.7,2025-11-26,6,28411,Preferred,False,True,5,2025-09-07T01:29:29.225011
STU00553,Aadhya S. Thakur,aadhya553@college.ac.in,0891150220,8.25,"swift, tableau, python, xamarin, ruby, c#, php, go, express.js, network security",B.E Computer Science,VIT Vellore,Pune,female,2,"PhonePe, EY, JP Morgan, Unacademy, Axis Bank, HDFC Bank",,https://linkedin.com/in/aadhya-thakur-553,94.5,2025-12-04,12,28608,No,False,True,12,2025-09-04T01:29:29.225011
STU00554,Kavya Joshi,kavya554@college.ac.in,04231314587,8.14,"r, reinforcement learning, computer vision, kotlin, neural networks, natural language processing, kubernetes, pandas",B.Tech IT,IIT Bombay,Mumbai,general,2,"Zomato, Ola, Cognizant, Morgan Stanley, Paytm, Infosys, Tech Mahindra",https://github.com/kavyajoshi554,https://linkedin.com/in/kavya-joshi-554,61.2,2025-11-11,12,29039,Preferred,False,True,1,2025-09-05T01:29:29.225011
STU00555,Daksh Q. Yadav,yadav.daksh@gmail.com,6303571996,6.98,"ethical hacking, pytorch, firewall, sketch, cryptography, terraform, kubernetes, network security",B.Tech IT,BITS Pilani,Bangalore,rural,2,"Swiggy, TCS, Wipro, Meta, Infosys, Axis Bank",https://github.com/dakshyadav555,https://linkedin.com/in/daksh-yadav-555,94.0,2025-10-21,6,71289,Yes,True,True,2,2025-09-05T01:29:29.226010
STU00556,Riya J. Verma,riya.verma@student.edu,+917570469202,9.42,"swift, ethical hacking, penetration testing, firewall, sketch, cryptography, pandas, rust, spring boot",B.Tech CSE,Manipal Institute,Hyderabad,general,2,"Goldman Sachs, Deloitte, Wipro, Amazon",https://github.com/riyaverma556,https://linkedin.com/in/riya-verma-556,94.5,2025-11-30,6,38351,No,False,True,4,2025-09-11T01:29:29.226010
STU00557,Pooja D. Patel,patel.pooja@gmail.com,08370160643,8.04,"powerpoint, elasticsearch, computer vision, business analysis, natural language processing, aws, power bi, excel",M.Tech AI/ML,RV College,Pune,general,2,"HCL Technologies, PhonePe, Google, Wipro",https://github.com/poojapatel557,https://linkedin.com/in/pooja-patel-557,83.8,2025-11-11,12,79219,Preferred,False,True,21,2025-08-29T01:29:29.226010
STU00558,Amit M. Tiwari,amit558@college.ac.in,3742145338,7.77,"elasticsearch, swift, terraform, redis, wireframing, oracle, mongodb",M.Tech CSE,Manipal Institute,Kolkata,general,0,"HCL Technologies, Morgan Stanley, Flipkart, Tech Mahindra",https://github.com/amittiwari558,,82.4,2025-10-24,12,61693,Preferred,False,True,8,2025-08-25T01:29:29.226010
